<?xml version="1.0" encoding="UTF-8" standalone="no"?>
<terminkalender xmlns="http://www.rheinwerk-verlag.de/schroedinger/terminkalender" xmlns:xsi="http://www.w3.org/2001/XMLSchema-instance" xsi:schemaLocation="http://www.galileocomputing.de/schroedinger/terminkalender terminkalender.xsd">
	<besitzer>
		<name>Schrödinger</name>
	</besitzer>
	<termine name="Meine Termine">
		<termin>
			<was>Katze füttern</was>
			<wann>8:00</wann>
			<wo>Küche</wo>
		</termin>
		<termin>
			<was>Mit Freundin Schuhe einkaufen</was>
			<wann>9:00</wann>
			<wo>Schuhgeschäft</wo>
		</termin>
		<termin>
			<was>WoW spielen</was>
			<wann>20:00</wann>
			<wo>Am Computer</wo>
		</termin>
	<termin>
      <was>Mit DOM-API Musiksammlung von deiner Freundin als XML-Dokument erstellen.</was>
      <wann>Sofort</wann>
      <wo>Werkstatt</wo>
    </termin>
  </termine>
</terminkalender>
